Doc_ID	Cite_ID	Contents	Label	Paper_ID	URL	Document_part	Coords
doc0052	cite0613	"Morrison, ""Serial"" 319. 14. For more information on these projects and recent steps by AustLit to index international newspaper fiction, see Bode and Hetherington (nn 2, 4, 5)."		f2fac638972409255bbff547a99e94f006d09a04	http://library.oapen.org/bitstream/20.500.12657/23996/1/1006138.pdf	Raw_Reference	
doc0052	cite0614	"NLA, ""About Digitised Newspapers and More,"" trove.nla.gov.au/ ndp/del/about 21. For instance, to the (supplied) question ""What does the collection cover?"" the British Newspaper Archive answers, ""The British Library's newspa- 13. In 1841 the United Kingdom had a population of 26.7 million (Mitchell with Deane 8-9), compared with 17 million in the United States (U.S. Bureau of Statistics 249) and only 220,968 in the colonies (Australian Bureau of Statistics). These same reference sources are used for the later population statistics."		f2fac638972409255bbff547a99e94f006d09a04	http://library.oapen.org/bitstream/20.500.12657/23996/1/1006138.pdf	Raw_Reference	
doc0052	cite0615	"Price Warung's ""An Endorsement in Red"" appeared alongside Hen- nessey's ""The Mystery of Sea-Cliff Towers"" in Hennessey and Harper's 1898 Christmas annual and was subsequently republished in the Western Grazier in 1898. Bibliography ･･･ Ailwood, Sarah, and Maree Sainsbury. ""Copyright Law, Readers and Authors in Colonial Australia."" Journal for the Association of the Study of Australian Literature 14, no. 3 (2014): http://www.nla.gov.au/openpublish/index. php/jasal/article/view/3271/4094."		f2fac638972409255bbff547a99e94f006d09a04	http://library.oapen.org/bitstream/20.500.12657/23996/1/1006138.pdf	Raw_Reference	
doc0052	cite0616	"Algee-Hewitt, Mark, Sarah Allison, Marissa Gemma, Ryan Heuser, Franco Moretti, and Hannah Walser. ""Canon/Archive. Large-Scale Dynamics in the Literary Field."" Stanford Literary Lab Pamphlet 11 (2016). https://lit- lab.stanford.edu/LiteraryLabPamphlet11.pdf"		f2fac638972409255bbff547a99e94f006d09a04	http://library.oapen.org/bitstream/20.500.12657/23996/1/1006138.pdf	Raw_Reference	
doc0052	cite0617	"Berthon, Hilary, and Wan Wong. ""Facing the Future of Australian Newspa- pers."" 79th IFLA World Library and Information Congress, 2013, Singapore. http://library.ifla.org/234/1/153-berthon-en.pdf"		f2fac638972409255bbff547a99e94f006d09a04	http://library.oapen.org/bitstream/20.500.12657/23996/1/1006138.pdf	Raw_Reference	
doc0052	cite0618	"Bode, Katherine, and Carol Hetherington. ""Retrieving a World of Fiction: Building an Index-and an Archive-of Serialized Novels in Australian Newspapers, 1850-1914."" Script and Print 38, no. 3 (2015): 197-211."		f2fac638972409255bbff547a99e94f006d09a04	http://library.oapen.org/bitstream/20.500.12657/23996/1/1006138.pdf	Raw_Reference	
doc0052	cite0619	"Buurma, Rachel Sanger. ""The Fictionality of Topic Modeling: Machine Reading Anthony Trollope's Barsetshire Series."" Big Data & Society (July- December 2015): 1-6."		f2fac638972409255bbff547a99e94f006d09a04	http://library.oapen.org/bitstream/20.500.12657/23996/1/1006138.pdf	Raw_Reference	
doc0052	cite0620	"Cordell, Ryan. ""Two (of Three) Ways of Looking at C19 Newspaper Exchange Networks."" Ryan Cordell (blog). http://ryancordell.org/research/two-of- three/ Cordell, Ryan, and David Smith. ""Viral Texts: Mapping Networks of Reprint- ing in 19 th -Century Newspapers and Magazines."" http://viraltexts.org/ Crittenden, Victor. The Atlas. Sydney Weekly. Journal of Politics, Commerce and Literature: Index. Canberra: Mulini Press, 2006."		f2fac638972409255bbff547a99e94f006d09a04	http://library.oapen.org/bitstream/20.500.12657/23996/1/1006138.pdf	Raw_Reference	
doc0052	cite0621	"Drucker, Johanna. ""Distributed and Conditional Documents: Conceptual- izing Bibliographical Alterities."" MATLIT: Materialidades da Literatura/ Materialities of Literature 2, no. 1 (2014). iduc.uc.pt/index.php/matlit/ article/view/1891/1303"		f2fac638972409255bbff547a99e94f006d09a04	http://library.oapen.org/bitstream/20.500.12657/23996/1/1006138.pdf	Raw_Reference	
doc0052	cite0622	"Folsom, Ed. ""Database as Genre: The Epic Transformation of Archives."" PMLA 122, no. 5 (2007): 1571-79."		f2fac638972409255bbff547a99e94f006d09a04	http://library.oapen.org/bitstream/20.500.12657/23996/1/1006138.pdf	Raw_Reference	
doc0052	cite0623	"Johnson-Woods, Toni. Index to Serials in Australian Periodicals and Newspapers: Nineteenth Century. Canberra: Mulini Press, 2001."		f2fac638972409255bbff547a99e94f006d09a04	http://library.oapen.org/bitstream/20.500.12657/23996/1/1006138.pdf	Raw_Reference	
doc0052	cite0624	"Jones, Aled. ""Tillotson's Fiction Bureau: The Manchester Manuscripts."" Research Society for Victorian Periodicals 17, no. 1-2 (1984): 43-49."		f2fac638972409255bbff547a99e94f006d09a04	http://library.oapen.org/bitstream/20.500.12657/23996/1/1006138.pdf	Raw_Reference	
doc0052	cite0625	"Liddle, Dallas. ""Reflections on 20,000 Victorian Newspapers: 'Distant Read- ing' The Times using The Times Digital Archive."" Journal of Victorian Culture 17, no. 2 (2012): 230-37."		f2fac638972409255bbff547a99e94f006d09a04	http://library.oapen.org/bitstream/20.500.12657/23996/1/1006138.pdf	Raw_Reference	
doc0052	cite0626	"Manoff, Marlene. ""Theories of the Archive from Across the Disciplines."" Por- tal: Libraries and the Academy 4, no. 1 (2004): 9-25."		f2fac638972409255bbff547a99e94f006d09a04	http://library.oapen.org/bitstream/20.500.12657/23996/1/1006138.pdf	Raw_Reference	
doc0052	cite0627	"McCarty, Willard. Humanities Computing. Basingstoke: Palgrave Macmillan, 2005. McGann, Jerome, ed. ""The Complete Writings and Pictures of Dante Gabriel Rossetti."" http://www.rossettiarchive.org/"		f2fac638972409255bbff547a99e94f006d09a04	http://library.oapen.org/bitstream/20.500.12657/23996/1/1006138.pdf	Raw_Reference	
doc0052	cite0628	"McGann, Jerome. ""Database, Interface, and Archive Fever."" PMLA 122, no. 5 (2007): 1588-92."		f2fac638972409255bbff547a99e94f006d09a04	http://library.oapen.org/bitstream/20.500.12657/23996/1/1006138.pdf	Raw_Reference	
doc0052	cite0629	"McGregor, Hannah, Faye Hammill, Paul Hjartarson, Clare Mulcahy, and Nick van Orden, eds. Modern Magazine Project Canada. http://modmag. ca/whm/ McKenzie, D. F. Bibliography and the Sociology of Texts: The Panizzi Lectures. 1986. London: British Library, 1999."		f2fac638972409255bbff547a99e94f006d09a04	http://library.oapen.org/bitstream/20.500.12657/23996/1/1006138.pdf	Raw_Reference	
doc0052	cite0630	"Morrison, Elizabeth. ""Retrieving Colonial Literary Culture: The Case for an Index to Fiction in Australian (or Australasian?) Newspapers."" Bib- liographical Society of Australia and New Zealand Bulletin 13, no. 1 (1989): 27-36."		f2fac638972409255bbff547a99e94f006d09a04	http://library.oapen.org/bitstream/20.500.12657/23996/1/1006138.pdf	Raw_Reference	
doc0052	cite0631	"Pasquale, Frank. The Black Box Society: The Secret Algorithms That Control Money and Information. Cambridge, MA: Harvard University Press, 2015."		f2fac638972409255bbff547a99e94f006d09a04	http://library.oapen.org/bitstream/20.500.12657/23996/1/1006138.pdf	Raw_Reference	
doc0052	cite0632	"Price, Kenneth M. ""Edition, Project, Database, Archive, Thematic Research Collection: What's in a Name?"" Digital Humanities Quarterly 3, no. 3 (2009). http://www.digitalhumanities.org/dhq/vol/3/3/000053/000053.html"		f2fac638972409255bbff547a99e94f006d09a04	http://library.oapen.org/bitstream/20.500.12657/23996/1/1006138.pdf	Raw_Reference	
doc0052	cite0633	"Robinson, Julia. ""Searching for Words."" National Library Magazine 5, no. 2 (2013): 28-30."		f2fac638972409255bbff547a99e94f006d09a04	http://library.oapen.org/bitstream/20.500.12657/23996/1/1006138.pdf	Raw_Reference	
doc0052	cite0634	"Solberg, Janine. ""Googling the Archive: Digital Tools and the Practice of His- tory."" Advances in the History of Rhetoric 15, no. 1 (2012): 53-78."		f2fac638972409255bbff547a99e94f006d09a04	http://library.oapen.org/bitstream/20.500.12657/23996/1/1006138.pdf	Raw_Reference	
doc0052	cite0635	"Wynne, Emma. ""Budget 2016: Cuts Force Online Archive Trove to Stop Add- ing to Collection."" ABC News Online, May 5, 2016. http://www.abc.net. au/news/2016-05-05/national-library-trove-project-not-funded-to-add- to-collection/7377634"		f2fac638972409255bbff547a99e94f006d09a04	http://library.oapen.org/bitstream/20.500.12657/23996/1/1006138.pdf	Raw_Reference	
doc0052	cite0636	"Index ･･･ Aboriginal characters in nineteenth- century Australian fiction, 12, 159, 176-80, 196, 202, 206; exclusion from criticism, 12, 176, 180, 227n17"		f2fac638972409255bbff547a99e94f006d09a04	http://library.oapen.org/bitstream/20.500.12657/23996/1/1006138.pdf	Raw_Reference	
doc0052	cite0637	"British fiction in nineteenth-century Australian newspapers, 2, 101, 105- 06, 121, 136-37, 145, 167, 195-96, 199, 219n154; colonial readers sup- posed preference for, 4, 9-10, 97-98, 104, 158; cultural value of, 86, 100, 103-04, 108, 110-12, 118-19, 201; prediction of authorship of, 170- 72, 185-88, 190, 192, 226-27n15; prevalence of men's writing, 86, 97, 99, 105, 108, 111, 116; representa- tions of temporality in, 12, 159, 169, 180-81, 185, 192, 201; syndication of, 11, 110, 124, 132, 139-42, 143, 150, 152, 155, 202, 222n14. See also copyright, of British fiction British Library, 68, 215-16n21. See also British Newspaper Archive British Newspaper Archive, 47, 68, 70, 215-16n21"		f2fac638972409255bbff547a99e94f006d09a04	http://library.oapen.org/bitstream/20.500.12657/23996/1/1006138.pdf	Raw_Reference	
doc0052	cite0638	"Chambers' Edinburgh Journal 145; dominance of women's fiction in, 86, 98, 202, 220n27, 226-27n15; Family Herald 63; Illustrated London News 63; nineteenth century, 40, 65, 119, 145, 148, 222n14; Tit-Bits, 63. See also Brit- ish Newspaper Archive Bulletin Magazine, 120, 157, 174"		f2fac638972409255bbff547a99e94f006d09a04	http://library.oapen.org/bitstream/20.500.12657/23996/1/1006138.pdf	Raw_Reference	
doc0052	cite0639	"Chronicling America, 48, 68, 70, 75, 217n36. See also Library of Congress; Viral Texts Project city mysteries, 204-05, 207"		f2fac638972409255bbff547a99e94f006d09a04	http://library.oapen.org/bitstream/20.500.12657/23996/1/1006138.pdf	Raw_Reference	
doc0052	cite0640	"Harte, Bret, 110, 219n20 HathiTrust Digital Library, 40, 44, 51, 52, 54-56"		f2fac638972409255bbff547a99e94f006d09a04	http://library.oapen.org/bitstream/20.500.12657/23996/1/1006138.pdf	Raw_Reference	
doc0052	cite0641	"Libbey, Laura Jean, 2, 104, 111 libraries, 44, 85, 213n2; digital, 22, 40, 51-52, 68; public, 24, 51, 71-72, 149; university, 24, 51, 55, 91, 104. See also British Library; Google Books;"		f2fac638972409255bbff547a99e94f006d09a04	http://library.oapen.org/bitstream/20.500.12657/23996/1/1006138.pdf	Raw_Reference	
doc0052	cite0642	"HathiTrust Digital Library; Library of Congress; National Library of Australia Library of Congress, 48, 68. See also Chronicling America Linton, Eliza Lynn, 134"		f2fac638972409255bbff547a99e94f006d09a04	http://library.oapen.org/bitstream/20.500.12657/23996/1/1006138.pdf	Raw_Reference	
doc0052	cite0643	"National Library of Australia, 1, 68, 75, 81;"		f2fac638972409255bbff547a99e94f006d09a04	http://library.oapen.org/bitstream/20.500.12657/23996/1/1006138.pdf	Raw_Reference	
doc0183	cite0644	"Zakim, M. (2013). Creating a democracy of common men. In S. P. Adams, A Companion to the Era of Andrew Jackson (170-193). West Sussex, UK: Blackwell Publishing Ltd. Burke, R. (2003). Andrew Jackson. Chicago, IL: Heinemann Library."		f118c6cf9220c704ac788ae67d255a98328620ca	https://thekeep.eiu.edu/cgi/viewcontent.cgi?article=3386&context=theses	Raw_Reference	
doc0183	cite0645	"Gutman, W. (1987). Andrew Jackson and the new populism. Hauppauge, NY: Barron's Educational Series, Inc."		f118c6cf9220c704ac788ae67d255a98328620ca	https://thekeep.eiu.edu/cgi/viewcontent.cgi?article=3386&context=theses	Raw_Reference	
doc0062	cite0646	"""Ambivalences of American Foreign Policy,"" speech at Indiana University, 5 March 1965 , Acheson papers, box 141, Truman Library. For Acheson 's efforts in 1966 and 1967 , see below."	ABOUT	fa3d723b070d7d15917975d789fbedc77d0badcc	https://mospace.umsystem.edu/xmlui/bitstream/10355/35164/1/ColdWarAndBlackLiberation.pdf	Raw_Reference	
doc0062	cite0647	". Department of State to Bundy, ""Updating of Portuguese-U.S. Relations,"" 24 August 1961, NSF: Portugal, box 154, Kennedy Library. See also same to same, ""Selvage & Lee,"" 25 September 1961, ibid., and the summary of the campaign enclosed in Fredericks to Bowles, 14 July 1962, Bowles Papers, box 299, Yale University."	ABOUT	fa3d723b070d7d15917975d789fbedc77d0badcc	https://mospace.umsystem.edu/xmlui/bitstream/10355/35164/1/ColdWarAndBlackLiberation.pdf	FootNote	
doc0062	cite0648	"R 81. ""American Negro Leadership Conference on Africa Resolutions, "" enclosed in Williams to usk, 3 December 1962 , ibid. 3 82. Bowles to Kennedy, ""Report of Mission to Africa,"" 13 November 1962 , Bowles Papers, box II, Yale University. 83 . Bowles to Kennedy, I December 1962 , ibid ., box 297.84 . The resolution on 14 December called for "" immediate independence"" for Angola and an embargo on arms to Portugal. It passed 82-7 with 13 abstentions. On 18 December the General Assembly passed by a vote of 57-14 (with 18 abstentions) a motion condemning ""mass exterminalion"" in Angola and again calling for an arms embargo. A summary of the votes and American rallonale is "" US , UN , and Portugal ,"" undated , NSF: Portugal, box 154, Kennedy Library."	ABOUT	fa3d723b070d7d15917975d789fbedc77d0badcc	https://mospace.umsystem.edu/xmlui/bitstream/10355/35164/1/ColdWarAndBlackLiberation.pdf	FootNote	
doc0062	cite0649	". On American attempts to help Roberto see Godley to Rusk , 24 March 1965, NSF: Congo, box 4 , Johnson Library. Fot CIA concern about radicalism in the liberation movements see CIA Special MemorandumNo. 14-65, ""Prospects in Brazzaville,"" 17 May 1965, ibid."	ABOUT	fa3d723b070d7d15917975d789fbedc77d0badcc	https://mospace.umsystem.edu/xmlui/bitstream/10355/35164/1/ColdWarAndBlackLiberation.pdf	FootNote	
doc0062	cite0650	"Holcomb to the Department of State, ""Probable Policy of the Nationalist Government,"" 16 June 1948, RG59, S0848a.OO/6-1648, National Archives."	STRICT	fa3d723b070d7d15917975d789fbedc77d0badcc	https://mospace.umsystem.edu/xmlui/bitstream/10355/35164/1/ColdWarAndBlackLiberation.pdf	Raw_Reference	
doc0062	cite0651	"North Winship to the Secretary of State, ""Further Developments in the Implementation of Apartheid,"" 5 October 1948, RG59, S0848.4016/10-548, National Archives."	STRICT	fa3d723b070d7d15917975d789fbedc77d0badcc	https://mospace.umsystem.edu/xmlui/bitstream/10355/35164/1/ColdWarAndBlackLiberation.pdf	Raw_Reference	
doc0062	cite0652	"Robert A. Lovett, ""Memorandum for the President,"" 23 November 1948; T. R. O. Muir to Matthew Connelly, 17 November 1948, White House Central Files : Official File, box 451, Truman Library. 21. New York Times, 24 July 1948, p. 3; 25 July 1948, p. 13."	STRICT	fa3d723b070d7d15917975d789fbedc77d0badcc	https://mospace.umsystem.edu/xmlui/bitstream/10355/35164/1/ColdWarAndBlackLiberation.pdf	Raw_Reference	
doc0062	cite0653	"""Memorandum of Conversation,"" 29 March 1949, Dean Acheson Papers, box 64, Truman Library."	STRICT	fa3d723b070d7d15917975d789fbedc77d0badcc	https://mospace.umsystem.edu/xmlui/bitstream/10355/35164/1/ColdWarAndBlackLiberation.pdf	Raw_Reference	
doc0062	cite0654	"Kennedy to Luthuli, 15 November 1961, NSF: Africa , box 2, Kennedy Library."	STRICT	fa3d723b070d7d15917975d789fbedc77d0badcc	https://mospace.umsystem.edu/xmlui/bitstream/10355/35164/1/ColdWarAndBlackLiberation.pdf	Raw_Reference	
doc0062	cite0655	"American Committee on Africa, The South African Crisis and U.S. Policy, 6 . 14. Department of State ""Memorandum of Conversation,"" 17 June 1964, ibid.; SDB SI (6 July 1964): 29-33; (13 July 1964): SI-54. IS. Carl Rowan to Johnson, ""African Reaction to Recent U.S. Civil Rights Developments,"" 21 July 1964, CF: Africa , box 6, Johnson Library."	STRICT	fa3d723b070d7d15917975d789fbedc77d0badcc	https://mospace.umsystem.edu/xmlui/bitstream/10355/35164/1/ColdWarAndBlackLiberation.pdf	Raw_Reference	
doc0062	cite0656	"""Memorandum for the President: Meeting with Mr. Lewis Douglas,"" 29 July 1964, ""Memo- randum for the President: Harry Oppenheimer,"" 2S September 1964, NSF: South Africa, box 2, johnson Library."	STRICT	fa3d723b070d7d15917975d789fbedc77d0badcc	https://mospace.umsystem.edu/xmlui/bitstream/10355/35164/1/ColdWarAndBlackLiberation.pdf	Raw_Reference	
doc0062	cite0657	"Department of State Intelligence and Research Memorandum, ""Dragon Rouge : African Reactions and Other Estimates,"" November 1964, NSF: Congo, box 3, Johnson Library. NeW Republic 151 (26 December 1964): 9-10."	STRICT	fa3d723b070d7d15917975d789fbedc77d0badcc	https://mospace.umsystem.edu/xmlui/bitstream/10355/35164/1/ColdWarAndBlackLiberation.pdf	Raw_Reference	
doc0062	cite0658	"Williams to Harriman, 11 December 1964, Williams papers, box 4, National Archives. 37. New York Times , 8 December 1964 , p. 53."	STRICT	fa3d723b070d7d15917975d789fbedc77d0badcc	https://mospace.umsystem.edu/xmlui/bitstream/10355/35164/1/ColdWarAndBlackLiberation.pdf	Raw_Reference	
doc0062	cite0659	"White to Johnson, 18 December 1964, CF: South Africa, box 71; White to Johnson, 28 December 1964, CF: Africa, box 6, Johnson Library."	STRICT	fa3d723b070d7d15917975d789fbedc77d0badcc	https://mospace.umsystem.edu/xmlui/bitstream/10355/35164/1/ColdWarAndBlackLiberation.pdf	Raw_Reference	
doc0062	cite0660	"Humphrey to Johnson, undated , CF: Africa, box 6, Johnson Library ; New York Times , 27 May 1966, p. 1. 60. Rusk to Satterthwaite, 26 May 1966, NSF: South Africa , box 2, Johnson Library."	STRICT	fa3d723b070d7d15917975d789fbedc77d0badcc	https://mospace.umsystem.edu/xmlui/bitstream/10355/35164/1/ColdWarAndBlackLiberation.pdf	Raw_Reference	
doc0062	cite0661	"USIA to Rusk, ""Media Comments on Senator Kennedy's Visit to South Africa, "" 16 June 1966, CF: Africa, box 6, Johnson Library."	STRICT	fa3d723b070d7d15917975d789fbedc77d0badcc	https://mospace.umsystem.edu/xmlui/bitstream/10355/35164/1/ColdWarAndBlackLiberation.pdf	Raw_Reference	
doc0062	cite0662	"Rusk to U.S. embassies London and Pretoria, 7 February 1963, NSF: Africa, box 3, Kennedy Library."	STRICT	fa3d723b070d7d15917975d789fbedc77d0badcc	https://mospace.umsystem.edu/xmlui/bitstream/10355/35164/1/ColdWarAndBlackLiberation.pdf	Raw_Reference	
doc0062	cite0663	"Satterthwaite to the Department of State, 19 March 1964; Rusk to South African Foreign Ministry, 12 February 1964 and 19 March 1964; Brubeck to Bundy, 18 March 1964, NSF: South Africa, box 2, Johnson Library."	STRICT	fa3d723b070d7d15917975d789fbedc77d0badcc	https://mospace.umsystem.edu/xmlui/bitstream/10355/35164/1/ColdWarAndBlackLiberation.pdf	Raw_Reference	
doc0062	cite0664	"Namibian Mission to the United Nations to President Lyndon Johnson, 21 July 1966; Read to Rostow, 23 July 1966, CF: Africa, box 7, Johnson Library. I . Williams to Rusk , 16 April 1962 , Williams Papers , box 2, National Archives."	STRICT	fa3d723b070d7d15917975d789fbedc77d0badcc	https://mospace.umsystem.edu/xmlui/bitstream/10355/35164/1/ColdWarAndBlackLiberation.pdf	Raw_Reference	
doc0062	cite0665	"State Department Planning Group, "" The White Redoubt, "" 28 June 1962 ; National Security Council Memorandum, "" Problems of Southern Africa,"" 4 October 1962, NSF: Africa, box 2, Kennedy Library."	STRICT	fa3d723b070d7d15917975d789fbedc77d0badcc	https://mospace.umsystem.edu/xmlui/bitstream/10355/35164/1/ColdWarAndBlackLiberation.pdf	Raw_Reference	
doc0062	cite0666	"Bowles, "" Report on Mission to Africa, October IS-November 9, 1962 ,"" 13 November 1962, Bowles Papers, box 311, Yale University ; Williams to Rusk, "" Major Conclusions of Williams' African Trip ,"" 24 February 1963 , Williams Papers, box 3, National Archives."	STRICT	fa3d723b070d7d15917975d789fbedc77d0badcc	https://mospace.umsystem.edu/xmlui/bitstream/10355/35164/1/ColdWarAndBlackLiberation.pdf	Raw_Reference	
doc0062	cite0667	"Department of State, "" Memorandum of Conversation: Southern Rhodesia,"" 27 April 1964, NSF: United Kingdom, box 3, Johnson Library."	STRICT	fa3d723b070d7d15917975d789fbedc77d0badcc	https://mospace.umsystem.edu/xmlui/bitstream/10355/35164/1/ColdWarAndBlackLiberation.pdf	Raw_Reference	
doc0062	cite0668	"Satterthwaite to Rusk, Confidential, 24 June 1964, NSF: South Africa, box 2; U.S. consul, Salisbury to the Secretary of State, 8 July 1964; 9 Septmeber 1964, NSF: Rhodesia, box I, Johnson Library."	STRICT	fa3d723b070d7d15917975d789fbedc77d0badcc	https://mospace.umsystem.edu/xmlui/bitstream/10355/35164/1/ColdWarAndBlackLiberation.pdf	Raw_Reference	
doc0062	cite0669	"Belk to Bundy, 28 October 1964, NSF: United Kingdom, box 1; "" Statement by the Secretary of State on Developments in Rhodesia,"" NSF: Rhodesia, box I, Johnson Library."	STRICT	fa3d723b070d7d15917975d789fbedc77d0badcc	https://mospace.umsystem.edu/xmlui/bitstream/10355/35164/1/ColdWarAndBlackLiberation.pdf	Raw_Reference	
doc0062	cite0670	"Ball to Johnson , 18 November 1965; ""Outline of the Rhodesian Problem,"" I December 1965, NSF: Rhodesia , box 2, Johnson Library."	STRICT	fa3d723b070d7d15917975d789fbedc77d0badcc	https://mospace.umsystem.edu/xmlui/bitstream/10355/35164/1/ColdWarAndBlackLiberation.pdf	Raw_Reference	
doc0062	cite0671	""" BKS"" (Bromley Smith, Executive Secretary of the National Security Council) to BundY, 18 November 1965 , ibid. 31. Department of State, "" Memorandum for Mr. Bundy : the Rhodesian Crisis, "" 19 November 1965 , NSF: Rhodesia , box 2, Johnson Library."	STRICT	fa3d723b070d7d15917975d789fbedc77d0badcc	https://mospace.umsystem.edu/xmlui/bitstream/10355/35164/1/ColdWarAndBlackLiberation.pdf	Raw_Reference	
doc0062	cite0672	"Rusk to U.S. embassy, London, 21 January 1966, NSF: United Kingdom, box 2 , Johnson Library."	STRICT	fa3d723b070d7d15917975d789fbedc77d0badcc	https://mospace.umsystem.edu/xmlui/bitstream/10355/35164/1/ColdWarAndBlackLiberation.pdf	Raw_Reference	
doc0062	cite0673	"Mann to Johnson , ""Memorandum for the President: The Rhodesian Crisis,"" 22 December 1965, White House Central Files: Confidential Files, Rhodesia, box 1, Johnson Library. 47. Rusk to U.S. embassy, London, 28 December 1965 , NSF: United Kingdom, box 2, Johnson Library. '"	STRICT	fa3d723b070d7d15917975d789fbedc77d0badcc	https://mospace.umsystem.edu/xmlui/bitstream/10355/35164/1/ColdWarAndBlackLiberation.pdf	Raw_Reference	
doc0062	cite0674	"National Security Council , ""Rhodesian/Zambian Situation Report, No . 17,"" 26-27 January 1966; American legation, Salisbury, to the Department of State, 22 January 1966, NSF: Rhodesia, box 4 , Johnson Library."	STRICT	fa3d723b070d7d15917975d789fbedc77d0badcc	https://mospace.umsystem.edu/xmlui/bitstream/10355/35164/1/ColdWarAndBlackLiberation.pdf	Raw_Reference	
doc0062	cite0675	"Ball to U.S. embassay, London, 15 April 1966, NSF: United Kingdom, box 2, Johnson Library."	STRICT	fa3d723b070d7d15917975d789fbedc77d0badcc	https://mospace.umsystem.edu/xmlui/bitstream/10355/35164/1/ColdWarAndBlackLiberation.pdf	Raw_Reference	
doc0062	cite0676	"Frank Church, ""MemoranaumofConversation with Prime Minister Wilson, London, May 10, 1966"" enclosed in U.S. embassay, London, to Mr. Walt Rostow, !June 1966, NSF: United Kingdom, box 2, Johnson Library."	STRICT	fa3d723b070d7d15917975d789fbedc77d0badcc	https://mospace.umsystem.edu/xmlui/bitstream/10355/35164/1/ColdWarAndBlackLiberation.pdf	Raw_Reference	
doc0062	cite0677	"Most of the correspondence for 1966 and 1967 is in CF: Rhodesia, box 65. Some can also be fOUnd in the Confidential Files: Rhodesia . box n. Johnson Library."	STRICT	fa3d723b070d7d15917975d789fbedc77d0badcc	https://mospace.umsystem.edu/xmlui/bitstream/10355/35164/1/ColdWarAndBlackLiberation.pdf	Raw_Reference	
doc0062	cite0678	"Roche to Moyers , 6 September 1966, CF: Rhodesia, box 65 , Johnson Library. Moyers enclosed Roche 's letter in the documenls ""For the President's Night Reading ."""	STRICT	fa3d723b070d7d15917975d789fbedc77d0badcc	https://mospace.umsystem.edu/xmlui/bitstream/10355/35164/1/ColdWarAndBlackLiberation.pdf	Raw_Reference	
doc0062	cite0679	"Citizen 11 (February 1967): 19-21 and (June 1967): 17 ; Fredericks to the Arizona State Legislature, 3 February 1967, CF: Rhodesia, box 65, Johnson Library."	STRICT	fa3d723b070d7d15917975d789fbedc77d0badcc	https://mospace.umsystem.edu/xmlui/bitstream/10355/35164/1/ColdWarAndBlackLiberation.pdf	Raw_Reference	
doc0062	cite0680	"Angus Graham , Rhodesian Minister of External Affairs , to Colbert, 5 May 1967; Colbert to Johnson, undated, CF: Rhodesia , box 65 , Johnson Library."	STRICT	fa3d723b070d7d15917975d789fbedc77d0badcc	https://mospace.umsystem.edu/xmlui/bitstream/10355/35164/1/ColdWarAndBlackLiberation.pdf	Raw_Reference	
doc0062	cite0681	"Schlesinger, Arthur M.: assessment of Kennedy 's Index / 273"	STRICT	fa3d723b070d7d15917975d789fbedc77d0badcc	https://mospace.umsystem.edu/xmlui/bitstream/10355/35164/1/ColdWarAndBlackLiberation.pdf	Raw_Reference	
doc0062	cite0682	". Thomas Holcomb to the Department of State , Pretoria, 18 February 1948, 848a.OO/2-1848 and 4 March 1948, 848a.OO/3-148, General Records of the Department of State, Record Group 59, National Archives ."	STRICT	fa3d723b070d7d15917975d789fbedc77d0badcc	https://mospace.umsystem.edu/xmlui/bitstream/10355/35164/1/ColdWarAndBlackLiberation.pdf	FootNote	
doc0062	cite0683	". Holcomb to the Department of State, ""Report on the General Election,""13 May 1948. RG59,_ SD848a.OO/5-1348. National Archives."	STRICT	fa3d723b070d7d15917975d789fbedc77d0badcc	https://mospace.umsystem.edu/xmlui/bitstream/10355/35164/1/ColdWarAndBlackLiberation.pdf	FootNote	
